{
  "$schema": "./routing.schema.json",
  "$comment": "Which lane the leader dispatches for each kind of work. A lane is a runner plus a model. Read it through the route script, never by hand. Changed only through a pull request.",
  "schemaVersion": 1,
  "defaults": {
    "source": "xezar-skills",
    "version": 4
  },
  "leader": {
    "tool": "claude",
    "login": "default",
    "rule": "The leader's own login runs no tasks and is never in a rotation."
  },
  "tools": {
    "claude": {
      "usesLogins": true,
      "rotation": []
    },
    "codex": {
      "usesLogins": true,
      "rotation": []
    },
    "pi": {
      "usesLogins": false
    }
  },
  "lanes": {
    "claude/opus": {
      "tool": "claude",
      "model": "opus",
      "vendor": "anthropic",
      "tier": "very-strong",
      "vision": true,
      "imageGeneration": false,
      "local": false,
      "enforcesToolLimits": true,
      "advisoryOnly": false,
      "engineModel": "opus[1m]",
      "notes": [
        "Opus 5.5 can end an unattended turn with a progress note and no result; when a run stops that way, send \"continue\" on the same thread before you count it as done."
      ]
    },
    "claude/sonnet": {
      "tool": "claude",
      "model": "sonnet",
      "vendor": "anthropic",
      "tier": "mid",
      "vision": true,
      "imageGeneration": false,
      "local": false,
      "enforcesToolLimits": true,
      "advisoryOnly": false
    },
    "claude/haiku": {
      "tool": "claude",
      "model": "haiku",
      "vendor": "anthropic",
      "tier": "cheap",
      "vision": true,
      "imageGeneration": false,
      "local": false,
      "enforcesToolLimits": true,
      "advisoryOnly": false
    },
    "codex/gpt-6-astra": {
      "tool": "codex",
      "model": "gpt-6-astra",
      "vendor": "openai",
      "tier": "very-strong",
      "vision": true,
      "imageGeneration": true,
      "local": false,
      "enforcesToolLimits": true,
      "advisoryOnly": false
    },
    "codex/gpt-6-sol": {
      "tool": "codex",
      "model": "gpt-6-sol",
      "vendor": "openai",
      "tier": "strong",
      "vision": true,
      "imageGeneration": true,
      "local": false,
      "enforcesToolLimits": false,
      "advisoryOnly": false
    },
    "codex/gpt-6-luna": {
      "tool": "codex",
      "model": "gpt-6-luna",
      "vendor": "openai",
      "tier": "cheap",
      "vision": true,
      "imageGeneration": true,
      "local": false,
      "enforcesToolLimits": false,
      "advisoryOnly": false
    },
    "codex/gpt-5.6-sol": {
      "tool": "codex",
      "model": "gpt-5.6-sol",
      "vendor": "openai",
      "tier": "strong",
      "vision": true,
      "imageGeneration": true,
      "local": false,
      "enforcesToolLimits": false,
      "advisoryOnly": false
    },
    "codex/gpt-5.6-terra": {
      "tool": "codex",
      "model": "gpt-5.6-terra",
      "vendor": "openai",
      "tier": "mid",
      "vision": true,
      "imageGeneration": true,
      "local": false,
      "enforcesToolLimits": false,
      "advisoryOnly": false,
      "notes": [
        "Give Terra explicit allowed actions, never conditions."
      ]
    },
    "codex/gpt-5.6-luna": {
      "tool": "codex",
      "model": "gpt-5.6-luna",
      "vendor": "openai",
      "tier": "cheap",
      "vision": true,
      "imageGeneration": true,
      "local": false,
      "enforcesToolLimits": false,
      "advisoryOnly": false
    },
    "pi/deepseek-api/deepseek-flash": {
      "tool": "pi",
      "model": "deepseek-api/deepseek-flash",
      "vendor": "deepseek",
      "tier": "cheap",
      "vision": true,
      "imageGeneration": false,
      "local": false,
      "enforcesToolLimits": false,
      "advisoryOnly": false
    },
    "pi/deepseek-api/deepseek-v4-pro": {
      "tool": "pi",
      "model": "deepseek-api/deepseek-v4-pro",
      "vendor": "deepseek",
      "tier": "strong",
      "vision": false,
      "imageGeneration": false,
      "local": false,
      "enforcesToolLimits": false,
      "advisoryOnly": false,
      "fullShellReviews": true,
      "notes": [
        "No image input: it is in no row that has to see a screen.",
        "Reviews with a full shell, the fallback when Claude has no budget; the owner accepted that risk (#89)."
      ]
    },
    "pi/dgx-spark/deepseek-v4-flash-vision": {
      "tool": "pi",
      "model": "dgx-spark/deepseek-v4-flash-vision",
      "vendor": "deepseek",
      "tier": "cheap",
      "vision": true,
      "imageGeneration": false,
      "local": true,
      "enforcesToolLimits": false,
      "advisoryOnly": true
    },
    "pi/mac-m4/qwen38-flash-next-mlx-mixed-4-8bit": {
      "tool": "pi",
      "model": "mac-m4/qwen38-flash-next-mlx-mixed-4-8bit",
      "vendor": "alibaba",
      "tier": "cheap",
      "vision": false,
      "imageGeneration": false,
      "local": true,
      "enforcesToolLimits": false,
      "advisoryOnly": true
    }
  },
  "reservedLanes": {
    "codex/gpt-6-astra": {
      "escalation": true,
      "rows": [
        "generated-images",
        "diagrams",
        "security-review"
      ]
    }
  },
  "globalBans": [
    {
      "id": "no-self-review",
      "checkedAt": "dispatch",
      "rule": "A review, re-check or QA runs on a different model from the one that wrote the work."
    },
    {
      "id": "local-never-writes",
      "checkedAt": "file",
      "rule": "A lane with local: true is in no row with writes: true."
    },
    {
      "id": "pi-write-claude-review",
      "checkedAt": "merge",
      "rule": "What a pi lane wrote merges only after a review on a Claude lane, claude/sonnet first, or else on codex/gpt-6-astra. A DeepSeek lane never clears DeepSeek work: never-author bans the author's vendor."
    },
    {
      "id": "high-risk-other-vendor",
      "checkedAt": "dispatch",
      "rule": "A risk-high change is reviewed by a different vendor from its author when a lane of one has budget, and never on the author's login. When no Claude lane has budget, pi/deepseek-api/deepseek-v4-pro may be that reviewer, full shell and all."
    },
    {
      "id": "tool-limits",
      "checkedAt": "file",
      "rule": "A lane with enforcesToolLimits: false is in no reading row (writes: false and not runsCode) and in no security-and-release row. One exception: a lane with fullShellReviews: true may be in a review row, or a security row that only reads."
    }
  ],
  "vendorExclusions": [
    {
      "vendor": "anthropic",
      "why": "Claude declines to review or re-check work that a Claude model wrote or repaired, so a Claude lane is never independent of a Claude author chain."
    }
  ],
  "tieRule": "When two rows match, a row that narrows the other wins. Otherwise the lookAlike rule for the pair decides. When no rule decides, follow noMatch.",
  "noMatch": {
    "attended": "ask-owner",
    "unattended": "park",
    "rule": "When no row matches, ask the owner. When unattended, park the task in parked.md and dispatch nothing."
  },
  "lookAlikes": [
    {
      "rows": [
        "scoped-recheck",
        "review-response-one"
      ],
      "rule": "scoped-recheck judges whether a finding is fixed; review-response-one changes code to answer a verdict."
    },
    {
      "rows": [
        "conflict-repair",
        "merge-chain"
      ],
      "rule": "A PR that conflicts with its base is conflict-repair until the resolution is pushed to its branch; landing it afterwards is merge-chain.",
      "test": "A merge chain stopped on a conflict in two files hands that PR to conflict-repair, which pushes the resolution to the PR branch; merge-chain then lands it."
    },
    {
      "rows": [
        "generated-images",
        "diagrams"
      ],
      "rule": "A picture that must be invented is generated-images; a figure that must be correct is diagrams."
    },
    {
      "rows": [
        "ux-design",
        "ui-design",
        "design-system"
      ],
      "rule": "ux-design decides how a surface is used and comes first; ui-design decides how it looks, on a landed flow; design-system changes what every design is built from. A new component inside a feature is two tasks: design-system, then ui-design."
    },
    {
      "rows": [
        "refactor",
        "kit-refactor"
      ],
      "rule": "refactor restructures product code with no behaviour change; kit-refactor changes the pipeline's own tooling."
    },
    {
      "rows": [
        "evidence-pass",
        "ui-tests",
        "browser-qa"
      ],
      "rule": "ui-tests writes a suite that runs again tomorrow; browser-qa runs this change once and judges it; evidence-pass collects what already happened.",
      "test": "\"Test the UI\" is browser-qa when it means this change, and ui-tests when it means from now on."
    },
    {
      "rows": [
        "design-review",
        "browser-qa"
      ],
      "rule": "design-review judges a screen against the design; browser-qa judges whether the change works."
    },
    {
      "rows": [
        "ui-design",
        "ui-implementation"
      ],
      "rule": "ui-design writes design files and no product code; ui-implementation writes the product code that matches them.",
      "test": "\"Make it look right\" is ui-design when no design says what right is, and ui-implementation when one does."
    },
    {
      "rows": [
        "ui-implementation",
        "localisation"
      ],
      "rule": "Changing what a screen says in its current language is ui-implementation; making text translatable or adding a listed language is localisation."
    },
    {
      "rows": [
        "browser-qa",
        "acceptance-verification"
      ],
      "rule": "browser-qa asks whether the change works and broke nothing; acceptance-verification checks each accepted criterion of the issue."
    },
    {
      "rows": [
        "analysis-specs-research",
        "architecture-decision",
        "spike"
      ],